{"schema_version":"0.5.0","session":{"id":"00000000-0000-4000-8000-000000000000","timestamp":"2026-05-21T10:30:00Z","torch_version":"2.6.0","redaction_policy":"default-strict"},"compiled_graphs":[{"graph_id":"graph_0","nodes":[{"id":"arg0_1","op_type":"placeholder"},{"id":"arg1_1","op_type":"placeholder"},{"id":"arg2_1","op_type":"placeholder"},{"id":"t","op_type":"aten.t.default","inputs":["arg0_1"]},{"id":"addmm","op_type":"aten.addmm.default","inputs":["arg1_1","arg2_1","t"]},{"id":"relu","op_type":"aten.relu.default","inputs":["addmm"]},{"id":"add","op_type":"aten.add.Tensor","inputs":["relu","arg2_1"]},{"id":"output","op_type":"output","inputs":["add"]}]}],"iterations":[{"iteration_index":0,"cache_hit":false,"recompilation_triggered":false,"output_signature":"8c6327c15588eddf956a2cbdd19a08f21dec0d1a98720643a97a8d63de8cc92f"}]}
