{"schema_version":"0.5.0","session":{"id":"00000000-0000-4000-8000-000000000000","timestamp":"2026-05-21T10:30:00Z","torch_version":"2.6.0","redaction_policy":"default-strict"},"compiled_graphs":[{"graph_id":"graph_0","nodes":[{"id":"arg0_1","op_type":"placeholder"},{"id":"arg1_1","op_type":"placeholder"},{"id":"t","op_type":"aten.t.default","inputs":["arg0_1"]},{"id":"mm","op_type":"aten.mm.default","inputs":["arg1_1","t"]},{"id":"relu","op_type":"aten.relu.default","inputs":["mm"]},{"id":"output","op_type":"output","inputs":["relu"]}]}],"iterations":[{"iteration_index":0,"cache_hit":false,"recompilation_triggered":false,"output_signature":"1561511152738dbeec74d19a2e2c40ae6fca07629fed3ebe63cc5704dd370f3c"}]}
