{
  "schema_version": "0.5.0",
  "session": {
    "id": "00000000-0000-4000-8000-000000000001",
    "timestamp": "2026-05-21T10:30:00Z",
    "torch_version": "2.6.0",
    "redaction_policy": "default-strict"
  },
  "compiled_graphs": [],
  "iterations": [
    {
      "iteration_index": 0,
      "cache_hit": false,
      "output_signature": "out_A",
      "internal_state_snapshot": { "module_attrs_changed": [] }
    },
    {
      "iteration_index": 1,
      "cache_hit": true,
      "output_signature": "out_A",
      "internal_state_snapshot": { "module_attrs_changed": [] }
    },
    {
      "iteration_index": 2,
      "cache_hit": false,
      "output_signature": "out_B",
      "internal_state_snapshot": { "module_attrs_changed": ["running_step"] }
    },
    {
      "iteration_index": 3,
      "cache_hit": true,
      "output_signature": "out_B",
      "internal_state_snapshot": { "module_attrs_changed": [] }
    }
  ]
}
