{"schema_version":"0.5.0","session":{"id":"00000000-0000-4000-8000-00000000he50","timestamp":"2026-01-01T00:00:00Z","torch_version":"2.12.0","redaction_policy":"default-strict"},"compiled_graphs":[{"graph_id":"graph_0","nodes":[{"id":"arg0_1","op_type":"placeholder","out_shape":[256,64],"out_dtype":"float32"},{"id":"arg1_1","op_type":"placeholder","out_shape":[256],"out_dtype":"float32"},{"id":"arg2_1","op_type":"placeholder","out_shape":[16,64],"out_dtype":"float32"},{"id":"arg3_1","op_type":"placeholder","out_shape":[256],"out_dtype":"float32"},{"id":"arg4_1","op_type":"placeholder","out_shape":[256],"out_dtype":"float32"},{"id":"arg5_1","op_type":"placeholder","out_shape":[64,256],"out_dtype":"float32"},{"id":"arg6_1","op_type":"placeholder","out_shape":[256,64],"out_dtype":"float32"},{"id":"arg7_1","op_type":"placeholder","out_shape":[256],"out_dtype":"float32"},{"id":"arg8_1","op_type":"placeholder","out_shape":[256],"out_dtype":"float32"},{"id":"arg9_1","op_type":"placeholder","out_shape":[256],"out_dtype":"float32"},{"id":"arg10_1","op_type":"placeholder","out_shape":[64,256],"out_dtype":"float32"},{"id":"arg11_1","op_type":"placeholder","out_shape":[256,64],"out_dtype":"float32"},{"id":"arg12_1","op_type":"placeholder","out_shape":[256],"out_dtype":"float32"},{"id":"arg13_1","op_type":"placeholder","out_shape":[256],"out_dtype":"float32"},{"id":"arg14_1","op_type":"placeholder","out_shape":[256],"out_dtype":"float32"},{"id":"arg15_1","op_type":"placeholder","out_shape":[64,256],"out_dtype":"float32"},{"id":"arg16_1","op_type":"placeholder","out_shape":[64],"out_dtype":"float32"},{"id":"arg17_1","op_type":"placeholder","out_shape":[64],"out_dtype":"float32"},{"id":"t","op_type":"aten.t.default","inputs":["arg0_1"],"out_shape":[64,256],"out_dtype":"float32"},{"id":"addmm","op_type":"aten.addmm.default","inputs":["arg1_1","arg2_1","t"],"out_shape":[16,256],"out_dtype":"float32"},{"id":"add","op_type":"aten.add.Tensor","inputs":["addmm","arg3_1"],"out_shape":[16,256],"out_dtype":"float32"},{"id":"pow_1","op_type":"aten.pow.Tensor_Scalar","inputs":["add"],"attrs":{"arg1":2},"out_shape":[16,256],"out_dtype":"float32"},{"id":"mean","op_type":"aten.mean.dim","inputs":["pow_1"],"attrs":{"arg2":true},"out_shape":[16,1],"out_dtype":"float32"},{"id":"add_1","op_type":"aten.add.Scalar","inputs":["mean"],"attrs":{"arg1":1.1920928955078125e-7},"out_shape":[16,1],"out_dtype":"float32"},{"id":"rsqrt","op_type":"aten.rsqrt.default","inputs":["add_1"],"out_shape":[16,1],"out_dtype":"float32"},{"id":"mul","op_type":"aten.mul.Tensor","inputs":["add","rsqrt"],"out_shape":[16,256],"out_dtype":"float32"},{"id":"mul_1","op_type":"aten.mul.Tensor","inputs":["mul","arg4_1"],"out_shape":[16,256],"out_dtype":"float32"},{"id":"t_1","op_type":"aten.t.default","inputs":["arg5_1"],"out_shape":[256,64],"out_dtype":"float32"},{"id":"mm","op_type":"aten.mm.default","inputs":["mul_1","t_1"],"out_shape":[16,64],"out_dtype":"float32"},{"id":"t_2","op_type":"aten.t.default","inputs":["arg6_1"],"out_shape":[64,256],"out_dtype":"float32"},{"id":"addmm_1","op_type":"aten.addmm.default","inputs":["arg7_1","mm","t_2"],"out_shape":[16,256],"out_dtype":"float32"},{"id":"add_2","op_type":"aten.add.Tensor","inputs":["addmm_1","arg8_1"],"out_shape":[16,256],"out_dtype":"float32"},{"id":"pow_2","op_type":"aten.pow.Tensor_Scalar","inputs":["add_2"],"attrs":{"arg1":2},"out_shape":[16,256],"out_dtype":"float32"},{"id":"mean_1","op_type":"aten.mean.dim","inputs":["pow_2"],"attrs":{"arg2":true},"out_shape":[16,1],"out_dtype":"float32"},{"id":"add_3","op_type":"aten.add.Scalar","inputs":["mean_1"],"attrs":{"arg1":1.1920928955078125e-7},"out_shape":[16,1],"out_dtype":"float32"},{"id":"rsqrt_1","op_type":"aten.rsqrt.default","inputs":["add_3"],"out_shape":[16,1],"out_dtype":"float32"},{"id":"mul_2","op_type":"aten.mul.Tensor","inputs":["add_2","rsqrt_1"],"out_shape":[16,256],"out_dtype":"float32"},{"id":"mul_3","op_type":"aten.mul.Tensor","inputs":["mul_2","arg9_1"],"out_shape":[16,256],"out_dtype":"float32"},{"id":"t_3","op_type":"aten.t.default","inputs":["arg10_1"],"out_shape":[256,64],"out_dtype":"float32"},{"id":"mm_1","op_type":"aten.mm.default","inputs":["mul_3","t_3"],"out_shape":[16,64],"out_dtype":"float32"},{"id":"t_4","op_type":"aten.t.default","inputs":["arg11_1"],"out_shape":[64,256],"out_dtype":"float32"},{"id":"addmm_2","op_type":"aten.addmm.default","inputs":["arg12_1","mm_1","t_4"],"out_shape":[16,256],"out_dtype":"float32"},{"id":"add_4","op_type":"aten.add.Tensor","inputs":["addmm_2","arg13_1"],"out_shape":[16,256],"out_dtype":"float32"},{"id":"pow_3","op_type":"aten.pow.Tensor_Scalar","inputs":["add_4"],"attrs":{"arg1":2},"out_shape":[16,256],"out_dtype":"float32"},{"id":"mean_2","op_type":"aten.mean.dim","inputs":["pow_3"],"attrs":{"arg2":true},"out_shape":[16,1],"out_dtype":"float32"},{"id":"add_5","op_type":"aten.add.Scalar","inputs":["mean_2"],"attrs":{"arg1":1.1920928955078125e-7},"out_shape":[16,1],"out_dtype":"float32"},{"id":"rsqrt_2","op_type":"aten.rsqrt.default","inputs":["add_5"],"out_shape":[16,1],"out_dtype":"float32"},{"id":"mul_4","op_type":"aten.mul.Tensor","inputs":["add_4","rsqrt_2"],"out_shape":[16,256],"out_dtype":"float32"},{"id":"mul_5","op_type":"aten.mul.Tensor","inputs":["mul_4","arg14_1"],"out_shape":[16,256],"out_dtype":"float32"},{"id":"t_5","op_type":"aten.t.default","inputs":["arg15_1"],"out_shape":[256,64],"out_dtype":"float32"},{"id":"mm_2","op_type":"aten.mm.default","inputs":["mul_5","t_5"],"out_shape":[16,64],"out_dtype":"float32"},{"id":"sub","op_type":"aten.sub.Tensor","inputs":["mm_2","arg16_1"],"out_shape":[16,64],"out_dtype":"float32"},{"id":"div","op_type":"aten.div.Tensor","inputs":["sub","arg17_1"],"out_shape":[16,64],"out_dtype":"float32"},{"id":"output","op_type":"output","inputs":["div"]}]}],"iterations":[{"iteration_index":0,"cache_hit":false,"recompilation_triggered":false,"output_signature":"e169298f4deb873a75f023571e8277bfac787e19a8ca330bb78f1b5ab5162a12"}]}
